{
  "generated_at": "2026-09-05",
  "test_set_size": 44,
  "rationale": "openai/gpt-oss-20b is shipped. It sits exactly on the twenty billion parameter cap the problem statement sets, it is served in production by the configured provider, and it accepts strict json_schema constrained decoding, so the plan it returns is shaped by the contract rather than by prompting alone. That matters more here than raw capability: the model's only job is to turn a question into a QueryPlan, and a plan that fails validation is retried once and then refused. Llama 3.1 8B Instant is faster and cheaper and is the fallback worth testing when latency matters more than coverage; Llama 4 Scout has seventeen billion active parameters and sits between them. Because every figure is computed in DuckDB and checked against allowed_numbers before it is shown, a weaker model produces a clarification or a refusal rather than a wrong number, so the choice trades coverage against latency and never against correctness. THE PER-MODEL ACCURACY BELOW HAS NOT YET BEEN MEASURED AGAINST THE LIVE ENDPOINT. The figures are carried over from the fixture this file shipped with and are placeholders. Running eval/run_benchmark.py replaces them; it needs a provider allowance large enough for three models over forty-four questions, which the free tier's two hundred thousand tokens a day does not cover.",
  "models": [
    {
      "model": "openai/gpt-oss-20b",
      "params_b": 20,
      "shipped": true,
      "accuracy": {
        "intent": 0.95,
        "filters": 0.91,
        "computation": 1.0,
        "grounding": 1.0,
        "clarification": 0.86,
        "overall": 0.94,
        "by_category": {
          "A": 1.0,
          "B": 0.95,
          "C": 0.93,
          "D": 0.9,
          "E": 1.0,
          "F": 0.88,
          "G": 0.9,
          "H": 0.86
        }
      },
      "median_latency_ms": 1180,
      "tokens_per_question": 742
    },
    {
      "model": "meta-llama/llama-4-scout-17b-16e-instruct",
      "params_b": 17,
      "shipped": false,
      "accuracy": {
        "intent": 0.86,
        "filters": 0.8,
        "computation": 1.0,
        "grounding": 1.0,
        "clarification": 0.71,
        "overall": 0.87,
        "by_category": {
          "A": 1.0,
          "B": 0.9,
          "C": 0.86,
          "D": 0.8,
          "E": 1.0,
          "F": 0.75,
          "G": 0.8,
          "H": 0.71
        }
      },
      "median_latency_ms": 1640,
      "tokens_per_question": 810
    },
    {
      "model": "llama-3.1-8b-instant",
      "params_b": 8,
      "shipped": false,
      "accuracy": {
        "intent": 0.77,
        "filters": 0.7,
        "computation": 1.0,
        "grounding": 1.0,
        "clarification": 0.57,
        "overall": 0.81,
        "by_category": {
          "A": 0.95,
          "B": 0.85,
          "C": 0.79,
          "D": 0.7,
          "E": 1.0,
          "F": 0.63,
          "G": 0.7,
          "H": 0.57
        }
      },
      "median_latency_ms": 820,
      "tokens_per_question": 690
    }
  ]
}
